article_text,source,headline,bias
"Congress leader Priyanka Gandhi Vadra reached Lakhimpur Kheri on Tuesday to participate in the ""antim ardas (final rites)"" prayers of the protesting farmers who were mowed down in the Uttar Pradesh district earlier this month.Union Minister Ajay Mishra's son, Ashish Mishra, accused of running over farmers in Uttar Pradesh's Lakhimpur Kheri, was arrested on Saturday after being questioned for over 12 hours in Lakhimpur Kheri, and was subsequently sent to police custody for three days on Monday. The police said he had been giving ""evasive answers"" and not cooperating. He had skipped the summons yesterday due to health reasons, according to his father.His arrest came five days after he was named in a murder case. The charges against him would usually merit an immediate arrest and questions have been raised about whether he was afforded VIP treatment because of his father.Eight people, including four farmers, died in the UP district on October 3 after a car ran over a group of demonstrators protesting against the visit by junior Home Minister Ajay Mishra and UP's Deputy Chief Minister Keshav Prasad Maurya. Though the Union Minister admits the SUV that ran over farmers belongs to him, he maintains his son was not in it.The farmer said that the incident was a ""pre-planned conspiracy"". They demanded that Union Minister Ajay Mishra should also be removed from the government as he started this conspiracy and is also protecting the culprits in the case.Here are the Live Updates on the Lakhimpur Kheri Violence:Oct 12, 2021 17:13 (IST)Lakhimpur Violence: Ashish Mishra Interrogated At UP Crime Branch Office'The Uttar Pradesh Police today took Union Minister Ajay Mishra's son Ashish to the Crime Branch office in Lakhimpur for interrogation in the Lakhimpur Kheri violence case, a day after a court sent him to three-day police custody, an official said.Chief Judicial Magistrate Chintaram on Monday had granted three-day police remand, with the condition that Ashish Mishra would not be harassed and his lawyer would remain present during interrogation.He was arrested on Saturday night in connection with the October 3 Lakhimpur Kheri violence in which eight people, including four farmers, were killed.Oct 12, 2021 17:12 (IST)Heavy police presence at the Lucknow-Lakhimpur Highway as farmers hold a prayer meet for protesting farmers who died in #LakhimpurKheriViolence.NDTV's Alok Pandey reports pic.twitter.com/cYLgUBFxsr- NDTV (@ndtv) October 12, 2021Oct 12, 2021 15:09 (IST)The Congress delegation to meet the President tomorrow will comprise seven members, including Rahul Gandhi and Priyanka Gandhi VadraA delegation of Congress leaders, including former party president Rahul Gandhi, will meet President Ram Nath Kovind tomorrow and present a memorandum of facts on the Lakhimpur Kheri violence, party sources said.The seven-member delegation will comprise Leader of Opposition in the Rajya Sabha Mallikarjun Kharge, senior party leaders AK Antony and Ghulam Nabi Azad, Congress leader in the Lok Sabha Adhir Ranjan Chowdhury, party general secretary Priyanka Gandhi Vadra and KC Venugopal.Sources told news agency Press Trust of India that the delegation will meet the President Ram Nath Kovind tomorrow at 11:30 am.Oct 12, 2021 14:30 (IST)""Today the farmer needs all of us. We have to stand with them, with their families"": Congressलखीमपुर खीरी नरसंहार के शहीद किसानों की अंतिम अरदास में श्रीमती @priyankagandhiआज किसान को हम सबकी जरूरत है।हमें उनके साथ, उनके परिवारों के साथ खड़े होना होगा। pic.twitter.com/5OwnNRfrW7- Congress (@INCIndia) October 12, 2021Oct 12, 2021 14:28 (IST)Ashish Mishra's friend files surrender application in the Court of Judicial MagistrateLakhimpur violence case | Ankit Das, who is reportedly Ashish Mishra's friend, files surrender application in the CJM court; court to ask for a report from the concerned police station.- ANI UP (@ANINewsUP) October 12, 2021Oct 12, 2021 13:55 (IST)Lakhimpur Kheri Violence: Union Minister's Son Ashish Mishra Interrogated At UP Crime Branch OfficeThe Uttar Pradesh Police today took Union Minister Ajay Mishra's son Ashish to the Crime Branch office in Lakhimpur for interrogation in the Lakhimpur Kheri violence case, a day after a court sent him to three-day police custody, an official said.Oct 12, 2021 13:15 (IST)Priyanka Gandhi Vadra reaches Lakhimpur Kheri to pay last respects to farmers killed last weekPriyanka Gandhi Vadra arrives for the antim ardas (final prayers) in Lakhimpur Kheri to honour the farmers killed in the UP violence that claimed eight lives.Oct 12, 2021 12:35 (IST)Congress accused of ""fake sympathy"" in relation to the Lakhimpur Kheri violence#LakhimpurKheriViolence | Posters come up overnight accusing the #Congress of shedding 'crocodile tears' pic.twitter.com/9yO7dHxtoJ- NDTV (@ndtv) October 12, 2021Oct 12, 2021 12:22 (IST)Thousands expected to attend today's 'antim ardas' programme in #LakhimpurKheri's Tikunia. NDTV's Alok Pandey reports pic.twitter.com/mg8WmkV6qo- NDTV (@ndtv) October 12, 2021Oct 12, 2021 11:58 (IST)Bharatiya Kisan Union spokesperson Rakesh Tikait attends farmers' antim ardasNational spokesperson of the Bharatiya Kisan Union Rakesh Tikait is present at the antim ardas being held in Bareilly in honour of the farmers killed in UP.Oct 12, 2021 11:38 (IST)Rahul Gandhi-led Congress delegation to meet President tomorrow on UP farmers' killingThe Congress delegation, led by Rahul Gandhi, plans to meet President Ram Nath Kovind tomorrow in relation to the UP farmers' killing that took place in the Lakhimpur Kheri district.Oct 12, 2021 11:20 (IST)Antim ardas attendees observe a moment of silenceAttendees of the antim ardas observed a minute of silence to honour the farmers who were killed in the UP violence.Oct 12, 2021 10:56 (IST)Visuals from the antim ardas for the farmers killed in UP's Lakhimpur KheriPeople paid respects to the farmers killed in the violence in UP's Lakhimpur Kheri at their antim ardas (final rites).Oct 12, 2021 10:27 (IST)Union Minister Ajay Mishra's son Ashish brought to Reserve Police Lines for three-day police custodyOctober 3rd Lakhimpur Kheri violence | MoS Ajay Mishra Teni's son Ashish Mishra brought to Reserve Police Lines. His three-day Police remand begins today. pic.twitter.com/YuZOA5fz2V- ANI UP (@ANINewsUP) October 12, 2021Oct 12, 2021 10:09 (IST)Chhattisgarh Chief Minister Bhupesh Baghel said Yogi Government Will Not Retain Power In Uttar PradeshChhattisgarh Chief Minister Bhupesh Baghel, returning from Lakhimpur Kheri, said, ""There is anti-incumbency against the BJP government in UP. From farmers, youth, Scheduled communities to traders, everyone is upset with the CM. The Yogi government will not retain power in the state.""Mr Baghel, along with Congress leaders Rahul Gandhi and Priyanka Gandhi Vadra, had recently met families of farmers who died in Lakhimpur Kheri on October 3.Oct 12, 2021 09:48 (IST)Rashtriya Lok Dal Leader Jayant Singh briefly held at Bareilly Airport before being allowed to proceedOn my way now. All the passengers on the Delhi - Bareilly flight were also not allowed to exit the terminal while I was being restrained!- Jayant Singh (@jayantrld) October 12, 2021Oct 12, 2021 09:46 (IST)Rashtriya Lok Dal leader Jayant Singh stopped at Bareilly Airport while heading to Bareilly for 'antim ardas' of killed Lakhimpur Kheri farmersलखीमपुर किसानों की अंतिम अरदास में जाते समय राष्ट्रीय लोकदल के राष्ट्रीय अध्यक्ष चौधरी जयंत सिंह जी को बरेली जिला प्रशासन ने बरेली एयरपोर्ट पर जबरदस्ती रोक लिया है। क्या अब देश में किसानों के दुःख में शामिल होना भी अपराध है?#ChaudharyJayantSingh#Lakhimpur- Rashtriya Lok Dal (@RLDparty) October 12, 2021Oct 12, 2021 09:42 (IST)Priyanka Gandhi Vadra To Take Part In Final Prayers For UP Farmers TodayCongress leader Priyanka Gandhi Vadra will again head to Lakhimpur Kheri today to participate in the ""antim ardas (final rites)"" prayers of the protesting farmers who were mowed down in the Uttar Pradesh district earlier this month. Heavy barricading and police checks were visible on the Lucknow-Sitapur-Lakhimpur highway.""Rahul Gandhi Go Back, Priyanka Gandhi Go Back"" banners were also sighted along the highway. While some of the banners mentioned who had put them up, others appeared to have vague details about this aspect. All banners took digs at the Congress, saying 'people' don't want ""fake sympathy"".",ndtv,"Lakhimpur Kheri violence: Eight people, including four farmers, were killed in the incident.",L
"Farmer leader Rakesh Tikait arrived in Tikunia last nightLucknow: Congress leader Priyanka Gandhi Vadra arrived in Lakhimpur Kheri today and joined the mourners to participate in the ""antim ardas (final rites)"" prayers of the protesting farmers who were mowed down in the Uttar Pradesh district earlier this month.The Congress leader, flanked by party leader Deepender Hooda and UP Congress chief Ajay Kumar Lallu, sat among the mourners with her head covered with a dupatta.लखीमपुर खीरी नरसंहार के शहीद किसानों की अंतिम अरदास में श्रीमती @priyankagandhiआज किसान को हम सबकी जरूरत है।हमें उनके साथ, उनके परिवारों के साथ खड़े होना होगा। pic.twitter.com/5OwnNRfrW7— Congress (@INCIndia) October 12, 2021Ahead of her visit, heavy barricading and police checks were visible this morning on the Lucknow-Sitapur-Lakhimpur highway. ""Rahul Gandhi Go Back, Priyanka Gandhi Go Back"" banners were also sighted along the highway. While some of the banners mentioned who had put them up, others appeared to have vague details about this aspect. All banners took digs at the Congress, saying 'people' don't want ""fake sympathy"".The banners proclaiming farmers don't want ""fake sympathy""Preparations for the final prayers were made at a field, away from the spot where the violence took place in Tikonia village of Lakhimpur Kehri in poll-bound Uttar Pradesh.Ashish Mishra - son of Union Minister of State for home, Ajay Mishra - now arrested, is accused of running his SUV over slogan-shouting farmers in the district on October 3. Eight people, including four farmers, were killed in the incident.Farmers and leaders of various farm unions from various states and districts of the state  participated in the programme.Farmer leader and national spokesperson of Bhartiya Kisan Union (BKU) Rakesh Tikait arrived in Tikunia last night for the programme.लखीमपुर खीरी के तिकुनिया में शहीद किसानों के अंतिम अरदास स्थल पर पहुंच चुका हूं । pic.twitter.com/9HXpqv3a3h— Rakesh Tikait (@RakeshTikaitBKU) October 11, 2021On whether politicians will be part of the prayers, BKU-Tikait district vice president Balkar Singh said, ""No political leader will be allowed to share the stage where only Samyukta Kisan Morcha (SKM) leaders will be present.""PromotedListen to the latest songs, only on JioSaavn.comThe Samyukt Kisan Morcha (SKM) is the umbrella body of farmer unions spearheading the ongoing protests against the centre's farm laws.The visit comes a week after her arrest while she was on her way to meet the families of the farmers killed in violence. Dramatic videos showed her confrontation with UP cops, who, she claims, held her without a warrant or legal order.",ndtv,"Priyanka Gandhi Vadra will participate in the ""antim ardas"" prayers",L
"Everyone is upset with Yogi Adityanath, Chhattisgarh Chief Minister Bhupesh Baghel said. (File)Raipur: Chhattisgarh Chief Minister Bhupesh Baghel said that there is an anti-incumbency in Uttar Pradesh against the Yogi Adityanath government and it will not retain power in the state after the Assembly polls next year.Mr Baghel, who returned from Lakhimpur Kheri, said, ""There is anti-incumbency against the BJP government in UP. From farmers, youth, Scheduled communities to traders, everyone is upset with the CM. The Yogi government will not retain power in the state.""He has recently been appointed as Congress senior observer for the Uttar Pradesh Assembly elections.Mr Baghel, along with Congress leaders Rahul Gandhi and Priyanka Gandhi Vadra, had recently met families of farmers who died in Lakhimpur Kheri on October 3.PromotedListen to the latest songs, only on JioSaavn.comMr Baghel also attacked former chief minister Raman Singh, who had criticised Baghel for visiting Lakhimpur Kheri. The Chhattisgarh Chief Minister said, ""After the post-poll violence in West Bengal, the Chhattisgarh BJP had protested in the state. What is the connection of violence happening in West Bengal with Chhattisgarh? The BJP adopts double standard in everything."" (Except for the headline, this story has not been edited by NDTV staff and is published from a syndicated feed.)",ndtv,"Anti-Incumbency Against BJP In UP, Says Chhattisgarh Chief Minister",L
"Four farmers were run over by son of Union Minister Ajay MishraNew Delhi: The BJP held a four-hour meeting in Delhi to discuss the assembly polls in Uttar Pradesh due next year. The key question at the meet, sources said, was likely to be the possible fallout of last week's events in Lakhimpur Kheri, where four farmers were run over on October 3 -- allegedly by Ashish Mishra, the son of Union Minister Ajay Mishra.Junior home minister in Prime Minister Narendra Modi's government, Ajay Mishra has not resigned despite the nationwide outrage and opposition demands.Sources said there is no possibility of resignation for now. At a meeting with his boss, Union Home Minister Amit Shah last week, Mr Mishra said he or his son were not at the spot. Sources indicated that fresh overview could be taken on basis of the findings of the investigation if needed.The party, though, still needs to think ahead and sources said the knotty question of his resignation could be discussed at the meeting, which was attended by party secretary BL Santosh, UP in-charge Radha Mohan Singh, election in-charge Dharmendra Pradhan, UP BJP President Swatantra Dev, state BJP's organizational secretary Sunil Bansal and party chief JP Nadda.The deaths, and the state police's tardy response on the arrest of Ashish Mishra, have infuriated farmers.For the party, the choice is between alienating farmers or the Brahmins, who comprise 11 per cent of the state's population and are seen as upset with the BJP.Mr Mishra belongs to the Brahmin community, who though numerically small, are of crucial political importance given the given the huge role of caste in elections in the state, seen as a gateway to Delhi.The BJP's core constituency in the state when the Dalit votebank gained ascendancy, Brahmins have become deeply resentful with the selection of Yogi Adityanath -- a Rajput -- for the top post.Backing the Chief Minister for a second term, the BJP, over the last months, has been trying hard to gain back the favour of the community.In June, the party acquired Congress's Jitin Prasda regain the favour of its core constituency.It also tried a similar move in 2016 -- inducting another Brahmin face from the Congress, Rita Bahuguna Joshi, daughter of former Uttar Pradesh chief minister Hemwati Nandan Bahuguna.PromotedListen to the latest songs, only on JioSaavn.comBut the attempt failed with Ms Bahuguna-Joshi having no mass following in the state. Jitin Prasada suffers from a similar handicap.In comparison, Ajay Mishra has considerable clout in the Terai area and he has the image of a muscleman.",ndtv,Will Farmers' Deaths Hit Chances In Polls? BJP Holds Key Meet,L
"The RLD chief also hit out at the Yogi Adityanath-led government in UP (FILE)Noida: Ahead of next year's assembly elections in Uttar Pradesh, Rashtriya Lok Dal (RLD) chief Jayant Chaudhary on Monday asked people to not forget the Lakhimpur Kheri episode and take revenge for the atrocities on farmers though their votes.Mr Chaudhary also announced that if his party is voted into power in Uttar Pradesh, high court benches will be set up in western UP, Bundelkhand and Purvanchal areas of the state.He also promised that if his party comes to power, inter-caste couples getting married would be given Rs 1 lakh encouragement reward and scholarships would be doled out for the backward and Dalit students who secure admission in prestigious universities abroad.The RLD national president made the promises during public programmes in Muzaffarnagar and Amroha districts in western UP on Monday, organised as part of his 'Aashirwad Path' public outreach campaign in the state ahead of 2022 assembly polls.Currently UP, the country's most populous and one of the largest states in area, has a High Court in Allahabad with a bench in Lucknow.Demand for high court benches in other parts of the state have often cropped up in the past.""If RLD comes to power in Uttar Pradesh, our government would set up high court benches in western UP, Bundelkhand and Ghazipur (in Purvanchal),"" Mr Chaudhary said, according to a party statement.""Also, those who break caste barriers will be given an incentive of Rs one lakh for inter-caste marriages and special scholarships will be given to promising students from backward castes and Dalit community on getting admission in reputed universities of the world,"" he said.Assembly polls in Uttar Pradesh are expected early next year.During the events, the RLD chief also hit out at the Yogi Adityanath-led government in UP, saying not even BJP voters would have imagined the atrocities being committed by it.""You all have witnessed the Lakhimpur Kheri episode. The government has left behind even the British Raj in committing atrocities on the people. You must remember the names of the farmers who got martyred in Lakhimpur Kheri and you must take revenge for the atrocities though your votes,"" he told crowds at Budhana and Rajabpur.He alleged that Union Minister Ajay Mishra's son Ashish, who is an accused in the Lakhimpur Kheri case, was sitting at his home but the UP police did not arrest him soon after the incident.The minister's son Ashish was arrested on Saturday by the Uttar Pradesh Police in connection with the October 3 violence in which eight people, including four farmers, were killed.He was produced before a court late on Saturday night, which sent him to 14-day judicial custody.He also trained guns at the Narendra Modi-led government at the Centre, accusing it of helping ""corporate friends"" and not working for welfare of the common man, the poor and the farmer.""A recent survey showed that while the poor of the country battled starvation and many lost their jobs during the COVID-19 pandemic, the wealth of some selected rich men in the country doubled during the period. These are the same corporate friends of the government whose wealth increased,"" he alleged.He said if his party comes to power in UP, a Rs 2,500-crore entrepreneur fund would be started to specially give loans to people from the SC/ST communities in order to help them start their businesses.A separate Rs 2,500 crore fund would be set up to provide loans to youngsters for their agriculture-related start ups.PromotedListen to the latest songs, only on JioSaavn.com""If our party comes to power, we will ensure security and safety of everyone, including the minorities, in the state,"" Mr Chaudhary added.(Except for the headline, this story has not been edited by NDTV staff and is published from a syndicated feed.)",ndtv,Take Revenge Through Votes: Rashtriya Lok Dal Chief Over Farmers' Killing In UP,L
"The police headquarters will sanction/permit leave only for unavoidable reasons. (Representational)Lucknow: The leave of all Uttar Pradesh Police personnel has been cancelled till October 18 in view of the upcoming festivals and programmes scheduled by farmers' body Samyukt Kisan Morcha (SKM), officials said on Monday.""Due to festivals and programmes of SKM, all leave till October 18 are being cancelled,"" an order issued by Additional Director General, Law and Order, Prashant Kumar on Sunday said.""In case of any unavoidable reasons, the police headquarters will sanction/permit leave,"" the order added.""This order is being implemented with immediate effect,"" it further said.Durga Puja and Ramlila celebrations are currently going on in the state and Dusshera will be celebrated on October 15.The SKM has decided to hold ''antim ardas'' prayers on Tuesday for the four farmers who were killed in the violence in Lakhimpur Kheri on October 3. It has also announced a ''rail roko'' protest on October 18.PromotedListen to the latest songs, only on JioSaavn.comBesides, political parties are starting yatras in the state to galvanise public support for the 2022 assembly polls.Samajwadi Party president Akhilesh Yadav will be kicking off 'Samajwadi Vijay Yatra'' from Kanpur on Tuesday, while Pragatisheel Samajwadi Party Lohia (PSPL) chief Shivipal Yadav is also starting a yatra from Mathura the same day.",ndtv,Leave Of All UP Police Personnel Cancelled Till October 18: Officials,L
"Union Minister's son Ashish Mishra was today sent to 3-day police custody. He reportedly gave evasive answers about the Lakhimpur Kheri violenceLucknow: Union Minister's son Ashish Mishra, accused of running over farmers in Uttar Pradesh's Lakhimpur Kheri triggering violence that claimed eight lives earlier this month, was sent to police custody for three days on Monday.Son of Union Minister Ajay Mishra, Ashish Mishra was arrested on Saturday after being questioned for over 12 hours in Lakhimpur Kheri. The police said he had been giving ""evasive answers"" and not cooperating.His arrest came five days after he was named in a murder case. The charges against him usually merit an immediate arrest and questions have been raised whether he was afforded VIP treatment because of his father.According to top sources in the Uttar Pradesh Police, the minister's son was not able explain several points about his whereabouts during the incident on October 3. They were also yet to get answers to questions surrounding the discovery of two empty cartridges at the scene which back the farmers' claims of being fired at and contest those by Mr Mishra's men who say there was no firing.Witnesses have said he was missing from the event he said he was at between 2 and 4 pm - around the time the incident took place, his phone location showed him closer to the crime scene, and the driver of the SUV that rammed the farmers did not appear to match the description made by him.The senior UP Police officer, who waited three hours for Ashish Mishra to show up on Friday, questioned him till late into the night a day later after he was brought in through a backdoor, helping him avoid the media gaggle. In another questionable move, the UP cops had issued notice to Ashish Mishra under a section of law which concerns attendance of witnesses - not the accused.The arrest came a day after the Supreme Court reminded the Uttar Pradesh government that the law must take its course against ""whoever is involved""  amid nationwide outrage over the incident and mounting pressure from farmer groups.PromotedListen to the latest songs, only on JioSaavn.comAshish Mishra has been named in an FIR filed by the farmers who said he drove into a gathering of slogan-shouting demonstrators amid a peaceful black flag protest last Sunday. Eight people, including four farmers and four from the convoy, died in the incident and the violence that it triggered.Though the Union Minister's son admits the SUV that ran over farmers belongs to him, but he maintains he was not in it. His team said he had produced around 150 images to show that he was not in the car that crushed the farmers.",ndtv,3-Day Police Custody For Minister's Son Arrested Over Murder Of Farmers,L
